know%2:31:02::,"I wanted to grab her by the arm and beg her to wait , to consider , to know for_certain because life is so_long and marriage is so important .",,know%2:31:01:: : be cognizant or aware of a fact or a specific piece of information; possess knowledge or information about,,,,,,,,,,,,,,,,,,,
know%2:31:02::,"We expect him to be noble , and to make us so - yet he knows , and tries to tell us , how very humble man must be .",,know%2:31:01:: : be cognizant or aware of a fact or a specific piece of information; possess knowledge or information about,,,,,,,,,,,,,,,,,,,
know%2:31:02::,""" But "" , it said , "" do you always know when you 're happy "" ?",,know%2:31:01:: : be cognizant or aware of a fact or a specific piece of information; possess knowledge or information about,,,,,,,,,,,,,,,,,,,
know%2:31:02::,"I just came out here to know it "" .",,know%2:31:01:: : be cognizant or aware of a fact or a specific piece of information; possess knowledge or information about,,,,,,,,,,,,,,,,,,,
know%2:31:02::,"Whether or not this is done out of enlightened self-preservation , I do n't know .",,know%2:31:01:: : be cognizant or aware of a fact or a specific piece of information; possess knowledge or information about,,,,,,,,,,,,,,,,,,,
know%2:31:02::,"When we become firm enough to stand for those ideals which we know to be right , when we become hard enough to refuse to aid nations which do not permit self-determination , when we become strong enough to resist any_more drifts towards socialism in our own Nation , when we recognize that our enemy is Communism not war , and when we realize that concessions to Communists do not insure peace or freedom , then , and only then will we no_longer be "" soft "" .",,know%2:31:01:: : be cognizant or aware of a fact or a specific piece of information; possess knowledge or information about,,,,,,,,,,,,,,,,,,,
know%2:31:02::,I do n't know if this is the situation in other parts of the country ; apparently it is not .,,know%2:31:01:: : be cognizant or aware of a fact or a specific piece of information; possess knowledge or information about,,,,,,,,,,,,,,,,,,,
know%2:31:02::,He knew that his God would save him from his enemies because He had saved him from his sins .,,know%2:31:01:: : be cognizant or aware of a fact or a specific piece of information; possess knowledge or information about,,,,,,,,,,,,,,,,,,,
know%2:31:02::,"When that fear has been removed by faith in Jesus_Christ , when we know that He is our Savior , that He has paid our debt with His blood , that He has met the demands of God 's justice and thus has turned His wrath away - when we know that , we have peace with God in our hearts ; and_then , with this God on our side , we can face the whole world without_fear .",,know%2:31:01:: : be cognizant or aware of a fact or a specific piece of information; possess knowledge or information about,,,,,,,,,,,,,,,,,,,
know%2:31:02::,"When that fear has been removed by faith in Jesus_Christ , when we know that He is our Savior , that He has paid our debt with His blood , that He has met the demands of God 's justice and thus has turned His wrath away - when we know that , we have peace with God in our hearts ; and_then , with this God on our side , we can face the whole world without_fear .",,know%2:31:01:: : be cognizant or aware of a fact or a specific piece of information; possess knowledge or information about,,,,,,,,,,,,,,,,,,,
know%2:31:02::,"For_instance , we cannot know whether even for church_members the degree of conformity to Christian standards of morality increased or declined as the proportion of church_members in the population rose .",,know%2:31:01:: : be cognizant or aware of a fact or a specific piece of information; possess knowledge or information about,,,,,,,,,,,,,,,,,,,
know%2:31:02::,"If you know that he [ God ] is just [ righteous ] , know that everyone also who does what is just [ righteous ] has been_born of him .",,know%2:31:01:: : be cognizant or aware of a fact or a specific piece of information; possess knowledge or information about,,,,,,,,,,,,,,,,,,,
know%2:31:02::,"If you know that he [ God ] is just [ righteous ] , know that everyone also who does what is just [ righteous ] has been_born of him .",,know%2:31:01:: : be cognizant or aware of a fact or a specific piece of information; possess knowledge or information about,,,,,,,,,,,,,,,,,,,
know%2:31:02::,I knew in_that moment that I did not have any choice .,,know%2:31:01:: : be cognizant or aware of a fact or a specific piece of information; possess knowledge or information about,,,,,,,,,,,,,,,,,,,
know%2:31:02::,You only have_to think_of franks and sausages to know what I mean .,,know%2:31:01:: : be cognizant or aware of a fact or a specific piece of information; possess knowledge or information about,,,,,,,,,,,,,,,,,,,
know%2:31:02::,"When you see a needle in my hands you will know the family buttons have fallen_off and I have_to sew them back on , or get_out the safety_pins .",,know%2:31:01:: : be cognizant or aware of a fact or a specific piece of information; possess knowledge or information about,,,,,,,,,,,,,,,,,,,
know%2:31:02::,""" In_the_past anyone who said that 90 % of all malocclusion is hereditary was scoffed at ; now we know that family characteristics do affect tooth formation to a large extent "" , he says .",,know%2:31:01:: : be cognizant or aware of a fact or a specific piece of information; possess knowledge or information about,,,,,,,,,,,,,,,,,,,
know%2:31:02::,"And there are some positive results , though the final findings will not be known for a long_time - and_then further research can be formulated .",,know%2:31:01:: : be cognizant or aware of a fact or a specific piece of information; possess knowledge or information about,,,,,,,,,,,,,,,,,,,
know%2:31:02::,"I do not know if such a way_of_life can come to be a self-conscious challenge , but I suspect that it can .",,know%2:31:01:: : be cognizant or aware of a fact or a specific piece of information; possess knowledge or information about,,,,,,,,,,,,,,,,,,,
know%2:31:02::,"Now , riding this hospital bus , feeling isolated and utterly alone , I knew that she was genuine and unique , quite unlike any girl I had known before .",,know%2:31:01:: : be cognizant or aware of a fact or a specific piece of information; possess knowledge or information about,,,,,,,,,,,,,,,,,,,
know%2:31:02::,I knew that I 'd soon be back working as an orderly at the hospital or as a counterman at Union_News or Schraffts while waiting for another acting job to open .,,know%2:31:01:: : be cognizant or aware of a fact or a specific piece of information; possess knowledge or information about,,,,,,,,,,,,,,,,,,,
know%2:31:02::,After a while the signal became a buzz and I knew he was behind me .,,know%2:31:01:: : be cognizant or aware of a fact or a specific piece of information; possess knowledge or information about,,,,,,,,,,,,,,,,,,,
know%2:31:02::,"As she reached Dave and felt his arm go around her , felt him pull her to the safety of his person , she knew with the certainty of despair that something bad had happened to Lauren .",,know%2:31:01:: : be cognizant or aware of a fact or a specific piece of information; possess knowledge or information about,,,,,,,,,,,,,,,,,,,
know%2:31:02::,"But we must know if this is in_accordance_with your customs , and must have your agreement they will not misuse the power we put in their hands , to our hurt "" .",,know%2:31:01:: : be cognizant or aware of a fact or a specific piece of information; possess knowledge or information about,,,,,,,,,,,,,,,,,,,
know%2:31:02::,"The skiff was headed for the very center of the nebula - toward that place which , Jack knew now , could hold nothing less important than the very core of the Angel 's life and religion .",,know%2:31:01:: : be cognizant or aware of a fact or a specific piece of information; possess knowledge or information about,,,,,,,,,,,,,,,,,,,
know%2:31:02::,"Yet he knew the others were sleeping more soundly , now that they had renewed their contact with the_matter that had birthed them to send them riding high vacuum .",,know%2:31:01:: : be cognizant or aware of a fact or a specific piece of information; possess knowledge or information about,,,,,,,,,,,,,,,,,,,
know%2:31:02::,"When he saw the expression in her eyes , he knew he could n't send them on .",,know%2:31:01:: : be cognizant or aware of a fact or a specific piece of information; possess knowledge or information about,,,,,,,,,,,,,,,,,,,
know%2:31:02::,"I do n't know yet , it 's crazy ; I have_to think_about it .",,know%2:31:01:: : be cognizant or aware of a fact or a specific piece of information; possess knowledge or information about,,,,,,,,,,,,,,,,,,,
know%2:31:02::,"She had offered to walk , but Pamela knew she would not feel comfortable about her child until she had personally confided her to the care of the little pink woman who chose to be called "" Auntie "" .",,know%2:31:01:: : be cognizant or aware of a fact or a specific piece of information; possess knowledge or information about,,,,,,,,,,,,,,,,,,,
know%2:31:02::,"You had to know , also , that you were going_to fail .",,know%2:31:01:: : be cognizant or aware of a fact or a specific piece of information; possess knowledge or information about,,,,,,,,,,,,,,,,,,,
know%2:31:02::,I knew that both these cynics were waiting with_impatience for the dramatic moment when Viola was called to the stand .,,know%2:31:01:: : be cognizant or aware of a fact or a specific piece of information; possess knowledge or information about,,,,,,,,,,,,,,,,,,,
know%2:31:02::,""" You are bound_to get involved with people when you have children "" , Fran had told me at our first meeting , "" so it is good to know that those with whom you get involved are not just dreary little housewives and dull husbands , but People Who Do Things "" .",,know%2:31:01:: : be cognizant or aware of a fact or a specific piece of information; possess knowledge or information about,,,,,,,,,,,,,,,,,,,
licensed%5:00:00:authorized:00,"Doris_Hull , suffering from tuberculosis , was taken by her husband to see Otis_G._Carroll , a sanipractor - a licensed drugless healer - in Spokane .",licensed%5:00:00:official:00 : given official approval to act,,,,,,,,,,,,,,,,,,,,
licensed%5:00:00:authorized:00,"Ten students act_as managers for a high-school football_team , and of these managers a proportion p are licensed drivers .",licensed%5:00:00:official:00 : given official approval to act,,,,,,,,,,,,,,,,,,,,
likely%3:00:04::,"Centrally , however , the administrative problem was more complex and the sheer prestige of office was very likely an unfair advantage .",,likely%3:00:00:: : has a good chance of being the case or of coming about,,,,,,,,,,,,,,,,,,,
likely%3:00:04::,"Competitors came to receive higher percentage of General_Motors business in later years , but it is "" likely "" that this trend stemmed "" at_least in part "" from the needs of General_Motors outstripping du_Pont 's capacity .",,likely%3:00:00:: : has a good chance of being the case or of coming about,,,,,,,,,,,,,,,,,,,
likely%3:00:04::,"However likely it was , Pauling said , he could n't limit himself to it .",,likely%3:00:00:: : has a good chance of being the case or of coming about,,,,,,,,,,,,,,,,,,,
likely%3:00:04::,"Once_again , Tom_Horn was the first and most likely suspect , and he was brought_in for questioning immediately .",,likely%3:00:00:: : has a good chance of being the case or of coming about,,,,,,,,,,,,,,,,,,,
limp%5:00:00:stale:00,"He stood stiffly erect , clutching the staff , his body half hidden by the limp cloth .",,,limp%5:00:00:lax:01 : lacking or having lost rigidity,,,,,,,,,,,,,,,,,,
limp%5:00:00:stale:00,"There she extracted two limp vellum sheets and wrote_off the letters , one to Abel , one to Mark .",,,limp%5:00:00:lax:01 : lacking or having lost rigidity,,,,,,,,,,,,,,,,,,
limp%5:00:00:stale:00,"At the pool 's far end was the little cabana Joyce had mentioned , and on the water 's surface floated scattered lavender patches of limp looking lather .",,,limp%5:00:00:lax:01 : lacking or having lost rigidity,,,,,,,,,,,,,,,,,,
lose_weight%2:29:00::,"In the quantity of 900 calories a day , anyone will lose_weight on_it - 20 , 30 or 40 lbs . "" .",,,,,,,,,,,,,,,,,,,,,
lose%2:33:01::,"His teacher and his school_principal were conferred_with and everyone agreed that , if he kept_up with a certain amount of work at home , there was little danger of his losing a term .",,,,,,,"lose%2:40:02:: : fail to keep or to maintain; cease to have, either physically or in an abstract sense",,,,,,,,,,,,,,
lose%2:33:01::,"It is the year when ( 1 ) amiable Jim_Gentile of the Baltimore_Orioles ambled to the plate in consecutive innings with the bases loaded and , in unprecedented style , delivered consecutive grand-slam home_runs ; ( 2 ) Willie_Mays of the San_Francisco Giants borrowed a teammate 's bat and became the ninth big_leaguer to stroke four home_runs in a game ; ( 3 ) the Milwaukee_Braves tied a major-league record with fourteen home_runs in three games and lost two of them ; and ( 4 ) catcher Johnny_Blanchard of the New_York Yankees matched a record with home_runs in four successive times at bat , two of them as a pinch-hitter .",lose%2:33:00:: : fail to win,,,,,,,,,,,,,,,,,,,,
lose%2:35:00::,Just when it seems baseball might be losing its grip on the masses up pops heroics to start millions of tongues to wagging .,,,,,,,"lose%2:40:02:: : fail to keep or to maintain; cease to have, either physically or in an abstract sense",,,,,,,,,,,,,,
lose%2:35:00::,"But Mercer 's explanation was simple : "" I made_out the check and carried it around a_few days unsigned - in_case I lost it "" .",,,,,,lose%2:40:01:: : miss from one's possessions; lose sight of,,,,,,,,,,,,,,,
lose%2:35:00::,Some other good bills were lost in the shuffle and await future action .,,,,,,lose%2:40:01:: : miss from one's possessions; lose sight of,,,,,,,,,,,,,,,
lose%2:35:00::,"Mr._Eisenhower seized upon the incident of the postcard lost by a Peace_Corps girl in Nigeria to attack the entire Corps as a "" juvenile experiment "" and to suggest sending a Corps member to the moon .",,,,,,lose%2:40:01:: : miss from one's possessions; lose sight of,,,,,,,,,,,,,,,
lose%2:35:00::,"Perhaps golf , with a fashionable companion - but he 'd lost his clubs , had n't played in years .",,,,,,lose%2:40:01:: : miss from one's possessions; lose sight of,,,,,,,,,,,,,,,
madman%1:18:00::,"The Rebs were , to a Massachusetts corporal , "" fighting madmen or not men at_all but whiskey + gunpowder put into a human frame "" .",madman%1:18:01:: : a male insane person,,,,,,,,,,,,,,,,,,,,
madman%1:18:00::,From being a hated tyrant and madman he was now the symbol of all that was noblest and best in the history of Sweden .,madman%1:18:01:: : a male insane person,,,,,,,,,,,,,,,,,,,,
means%1:06:00::,"There is another means which should show the direction and relative value of the stresses in viscoelastic fluids that is not mentioned as_such in the literature , and that is the shape of the suspended drops of low viscosity fluids in shear fields .",,,means%1:04:00:: : to have the ability to produce a particular effect or achieve an end,,,,,,,,,,,,,,,,,,
means%1:06:00::,"The antithyroid drugs of the thiouracil type , however , are not antagonised by such means .",,,means%1:04:00:: : to have the ability to produce a particular effect or achieve an end,,,,,,,,,,,,,,,,,,
means%1:06:00::,"In_the_last_analysis , religion is the means of inducing , formulating , expressing , enhancing , implementing , and perpetuating man 's deepest experience - the religious .",,,means%1:04:00:: : to have the ability to produce a particular effect or achieve an end,,,,,,,,,,,,,,,,,,
means%1:06:00::,"For it had turned_out , by a further paradox of Cubism , that the means to an illusion of depth and plasticity had now become widely divergent from the means of representation or imaging .",,,means%1:04:00:: : to have the ability to produce a particular effect or achieve an end,,,,,,,,,,,,,,,,,,
means%1:06:00::,"For it had turned_out , by a further paradox of Cubism , that the means to an illusion of depth and plasticity had now become widely divergent from the means of representation or imaging .",,,means%1:04:00:: : to have the ability to produce a particular effect or achieve an end,,,,,,,,,,,,,,,,,,
means%1:06:00::,This he did by using utterly literal means to carry the forward push of the collage ( and of Cubism in_general ) literally into the literal space in_front of the picture_plane .,,,means%1:04:00:: : to have the ability to produce a particular effect or achieve an end,,,,,,,,,,,,,,,,,,
means%1:06:00::,"In 1920 , the Lambeth_Conference repeated its 1908 condemnation of contraception and issued "" an emphatic warning against the use of unnatural means for the avoidance of conception , together_with the grave dangers - physical , moral , and religious - thereby incurred , and against the evils which the extension of such use threaten the race "" .",,,means%1:04:00:: : to have the ability to produce a particular effect or achieve an end,,,,,,,,,,,,,,,,,,
means%1:06:00::,"Practically all the people of Laos , he explained - about two million of them - are rice farmers , and the means and motives of modern war are as strange to them as clocks and steel plows .",,,means%1:04:00:: : to have the ability to produce a particular effect or achieve an end,,,,,,,,,,,,,,,,,,
means%1:06:00::,"So in these pages the term "" technology "" is used to include any and all means which could amplify , project , or augment man 's control over himself and over other men .",,,means%1:04:00:: : to have the ability to produce a particular effect or achieve an end,,,,,,,,,,,,,,,,,,
means%1:06:00::,Means must be found to enable us to keep in touch as regularly and as efficiently as possible with our colleagues in other departments concerned with foreign_policy .,,,means%1:04:00:: : to have the ability to produce a particular effect or achieve an end,,,,,,,,,,,,,,,,,,
means%1:06:00::,"These things have been disseminated by other means , but always in the wake of extensive publication of analytic results .",,,means%1:04:00:: : to have the ability to produce a particular effect or achieve an end,,,,,,,,,,,,,,,,,,
meet%2:41:02::,The farmer 's life must be arranged to meet the demands of crops and livestock .,"meet%2:34:00:: : fill, satisfy or meet a want or need or condition or restriction",,,,,,,,,,,,,,,,,,,,
meet%2:41:02::,"Part-time farming gives a measure of security if the regular job is lost , provided the farm is owned free_of debt and furnishes enough income to meet fixed expenses and minimum living costs .","meet%2:34:00:: : fill, satisfy or meet a want or need or condition or restriction",,,,,,,,,,,,,,,,,,,,
meet%2:41:02::,"It could , by avoiding direct intervention , provide a short-of war strategy to meet short-of war infiltration .","meet%2:34:00:: : fill, satisfy or meet a want or need or condition or restriction",,,,,,,,,,,,,,,,,,,,
meet%2:41:02::,"The growing communications needs of this new State can best be met , as they have in other States , through the operation and development of such facilities by private enterprise .","meet%2:34:00:: : fill, satisfy or meet a want or need or condition or restriction",,,,,,,,,,,,,,,,,,,,
meet%2:41:02::,"Another patient , a paranoid woman , for many months infuriated not_only me but the ward personnel and her fellow patients by arrogantly behaving as though she owned the whole building , as though she were the only person in it whose needs were to be met .","meet%2:34:00:: : fill, satisfy or meet a want or need or condition or restriction",,,,,,,,,,,,,,,,,,,,
meet%2:41:02::,Annual authorizations of $ 15 million were added for area vocational education programs that meet national defense needs for highly skilled technicians .,"meet%2:34:00:: : fill, satisfy or meet a want or need or condition or restriction",,,,,,,,,,,,,,,,,,,,
meet%2:41:02::,Only the Federal_government is likely to be able to take a long-run and nation-wide view and to pay for training to meet national skilled manpower needs .,"meet%2:34:00:: : fill, satisfy or meet a want or need or condition or restriction",,,,,,,,,,,,,,,,,,,,
meet%2:41:02::,"With our current $ 3 per hundred tax_rate , it is safe to assume that this will qualify when you suggest a community should "" try to develop a modest industrial plant "" as the best way to meet these problems .","meet%2:34:00:: : fill, satisfy or meet a want or need or condition or restriction",,,,,,,,,,,,,,,,,,,,
meet%2:41:02::,"Until professional planners meet this situation squarely and update the concepts of zoning in a manner acceptable to the courts , I hope we in East_Greenwich can continue to shape our own destiny .","meet%2:34:00:: : fill, satisfy or meet a want or need or condition or restriction",,,,,,,,,,,,,,,,,,,,
meet%2:41:02::,How can we have the wisdom to meet such a new and difficult challenge ?,"meet%2:34:00:: : fill, satisfy or meet a want or need or condition or restriction",,,,,,,,,,,,,,,,,,,,
meet%2:41:02::,Still others sprang_up late in the century to meet conditions which arose from fresh stages of the revolutionary age .,"meet%2:34:00:: : fill, satisfy or meet a want or need or condition or restriction",,,,,,,,,,,,,,,,,,,,
meet%2:41:02::,"In recent weeks , as a result of a sweeping defense_policy reappraisal by the Kennedy_Administration , basic United_States strategy has been modified - and large new sums allocated - to meet the accidental-war danger and to reduce it as quickly as possible .","meet%2:34:00:: : fill, satisfy or meet a want or need or condition or restriction",,,,,,,,,,,,,,,,,,,,
meet%2:41:02::,"It met these problems by the creation of the state automobile maintenance unit ( more popularly called the motor_pool ) , a centralized operation for the maintenance and control of all state transportation .","meet%2:34:00:: : fill, satisfy or meet a want or need or condition or restriction",,,,,,,,,,,,,,,,,,,,
meet%2:41:02::,"They had been through trying times , but their faith in the Almighty had given them the courage and the strength to meet and overcome the many problems and difficulties that were the price they had to pay for freedom .","meet%2:34:00:: : fill, satisfy or meet a want or need or condition or restriction",,,,,,,,,,,,,,,,,,,,
meet%2:41:02::,"Something had to be done about the furnace , the fuel bills , the washing_machine , the doctor and dentist bills , about making money stretch for food , for the mortgage , for taxes , for shoes , for half_soles , for overshoes , for clothes , for the new leaks in the roof , for gas and light bills ; about keeping warm , about keeping well , about meeting the minor emergencies that came_up once , twice , fifty times a day .","meet%2:34:00:: : fill, satisfy or meet a want or need or condition or restriction",,,,,,,,,,,,,,,,,,,,
meet%2:42:01::,"In looking_for the best sites available that meet the requirements , you need information to compare the site with others .","meet%2:34:00:: : fill, satisfy or meet a want or need or condition or restriction",,,,,,,,,,,,,,,,,,,,
meet%2:42:01::,"Look at the physical features of the land to determine how desirable it is for use , what can be done to correct the faults , and what it will cost to make the area meet your needs in_comparison_to other sites .","meet%2:34:00:: : fill, satisfy or meet a want or need or condition or restriction",,,,,,,,,,,,,,,,,,,,
meet%2:42:01::,And further he must understand his obligation to the client to not_only meet his physical necessities but also to enhance and improve his life and to enlarge the cultural horizon of our society .,"meet%2:34:00:: : fill, satisfy or meet a want or need or condition or restriction",,,,,,,,,,,,,,,,,,,,
meet%2:42:01::,Such measures are essential to its job of presenting business and Government with the facts required to meet the objective of expanding business and improving the operation of the economy .,"meet%2:34:00:: : fill, satisfy or meet a want or need or condition or restriction",,,,,,,,,,,,,,,,,,,,
meet%2:42:01::,"To qualify for either type of loan , an applicant must be a small business or approved small business "" pool "" and must meet certain credit requirements .","meet%2:34:00:: : fill, satisfy or meet a want or need or condition or restriction",,,,,,,,,,,,,,,,,,,,
meet%2:42:01::,"To be eligible to borrow from a Bank_for_Cooperatives , a cooperative must be an association in which farmers act together in processing and marketing farm products , purchasing farm supplies , or furnishing farm business services , and must meet the requirements set_forth in the Farm_Credit_Act_of_1933 , as amended .","meet%2:34:00:: : fill, satisfy or meet a want or need or condition or restriction",,,,,,,,,,,,,,,,,,,,
meet%2:42:01::,"In considering BW defense , it must be recognized that a number of critical meteorological parameters must be met for an aerosol to exhibit optimum effect .","meet%2:34:00:: : fill, satisfy or meet a want or need or condition or restriction",,,,,,,,,,,,,,,,,,,,
meet%2:42:01::,"There are , of_course , certain times during the 24 - hour daily cycle when most_of these conditions will be met .","meet%2:34:00:: : fill, satisfy or meet a want or need or condition or restriction",,,,,,,,,,,,,,,,,,,,
meet%2:42:01::,An agent would likely be selected which would possess sufficient viability and virulence stability to meet realistic minimal logistic requirements .,"meet%2:34:00:: : fill, satisfy or meet a want or need or condition or restriction",,,,,,,,,,,,,,,,,,,,
