be%2:42:04::,"All about me there was a hectic interplay of meetings taking_place , like abrupt , jerky scenes in old silent_movies , joyous greetings and beginnings , huggings and kissings , enthusiastic forays into the festive night .","be%2:42:03:: : have the quality of being; (copula, used with an adjective or a predicate noun)",,,,,,,,,,,,,,,,,,,,
be%2:42:04::,"The meat wagon , therefore , was not out in_front of the house any_more , but the cluster of squad_cars was still there and there was a cop on the door downstairs to screen any comings and goings .","be%2:42:03:: : have the quality of being; (copula, used with an adjective or a predicate noun)",,,,,,,,,,,,,,,,,,,,
be%2:42:04::,"There was , furthermore , the crowd of curious onlookers gathered in the street and a couple more cops to hold them at a decent distance .","be%2:42:03:: : have the quality of being; (copula, used with an adjective or a predicate noun)",,,,,,,,,,,,,,,,,,,,
be%2:42:04::,"That was almost forty years ago "" .",occur,,,,,,,,,,,,,,,,,,,,
be%2:42:04::,There was no process of trial_and_error .,"be%2:42:03:: : have the quality of being; (copula, used with an adjective or a predicate noun)",,,,,,,,,,,,,,,,,,,,
be%2:42:04::,There was no display of either works_in_progress or of finished work .,"be%2:42:03:: : have the quality of being; (copula, used with an adjective or a predicate noun)",,,,,,,,,,,,,,,,,,,,
be%2:42:04::,"These shapes might have been mad , but there was no telling .","be%2:42:03:: : have the quality of being; (copula, used with an adjective or a predicate noun)",,,,,,,,,,,,,,,,,,,,
be%2:42:04::,There were tools about but they were neatly kept .,"be%2:42:03:: : have the quality of being; (copula, used with an adjective or a predicate noun)",,,,,,,,,,,,,,,,,,,,
be%2:42:04::,There was no confusion and no litter .,"be%2:42:03:: : have the quality of being; (copula, used with an adjective or a predicate noun)",,,,,,,,,,,,,,,,,,,,
be%2:42:04::,"But in his dressing_room was a large bouquet and a card that read , "" We 're with you all_the_way "" .",,,,,,,be%2:42:05:: : occupy a certain position or area; be somewhere,,,,,,,,,,,,,,
be%2:42:04::,"My men have been here all afternoon , setting_up for this thing "" .",,,,,,,be%2:42:05:: : occupy a certain position or area; be somewhere,,,,,,,,,,,,,,
be%2:42:04::,"Mike remained in trance ; there was much to grok , loose_ends to puzzle_over and fit into his growing - all that he had seen and heard and been at the Archangel_Foster_Tabernacle ( not just cusp when he and Digby had come face_to_face alone ) - why Bishop_Senator_Boone made him warily uneasy , how Miss_Dawn_Ardent tasted like a water_brother when she was not , the smell of goodness he had incompletely grokked in the jumping_up_and_down and wailing -","be%2:42:03:: : have the quality of being; (copula, used with an adjective or a predicate noun)",,,,,,,,,,,,,,,,,,,,
be%2:42:04::,""" Come_on , there 's some cold chicken and we 'll see what else "" .","be%2:42:03:: : have the quality of being; (copula, used with an adjective or a predicate noun)",,,,,,,,,,,,,,,,,,,,
be%2:42:04::,"Jubal said that his night-sight probably came from the conditions in which he had grown_up , and Mike grokked this was true but grokked that there was more to_it ; his foster_parents had taught him to see .","be%2:42:03:: : have the quality of being; (copula, used with an adjective or a predicate noun)",,,,,,,,,,,,,,,,,,,,
be%2:42:04::,"That 'll be plenty to eat by "" .","be%2:42:03:: : have the quality of being; (copula, used with an adjective or a predicate noun)",,,,,,,,,,,,,,,,,,,,
be%2:42:04::,The Old_Ones neither helped nor hindered this plan ; time was not_yet .,"be%2:42:03:: : have the quality of being; (copula, used with an adjective or a predicate noun)",,,,,,,,,,,,,,,,,,,,
be%2:42:04::,"Check with one of them , go_ahead - there 's no professional jealousy here "" .","be%2:42:03:: : have the quality of being; (copula, used with an adjective or a predicate noun)",,,,,,,,,,,,,,,,,,,,
be%2:42:04::,"Now look , there 's work to be done and lots of it .","be%2:42:03:: : have the quality of being; (copula, used with an adjective or a predicate noun)",,,,,,,,,,,,,,,,,,,,
be%2:42:04::,""" Though that does not mean that there may not be such records there .","be%2:42:03:: : have the quality of being; (copula, used with an adjective or a predicate noun)",,,,,,,,,,,,,,,,,,,,
be%2:42:04::,""" There will be no women aboard the Gabriel .","be%2:42:03:: : have the quality of being; (copula, used with an adjective or a predicate noun)",,,,,,,,,,,,,,,,,,,,
be%2:42:04::,"And , somewhere in_that enormous light , was his apartment .",,,,,,,be%2:42:05:: : occupy a certain position or area; be somewhere,,,,,,,,,,,,,,
be%2:42:04::,"There was the squat loose_jowled man , smiling lopsidedly up at him .","be%2:42:03:: : have the quality of being; (copula, used with an adjective or a predicate noun)",,,,,,,,,,,,,,,,,,,,
be%2:42:04::,"The coyote was calling again , and he hoped that this time there would be no other sounds to interrupt it .","be%2:42:03:: : have the quality of being; (copula, used with an adjective or a predicate noun)",,,,,,,,,,,,,,,,,,,,
be%2:42:04::,There would still be plenty of moments of regret and sadness and guilty relief .,"be%2:42:03:: : have the quality of being; (copula, used with an adjective or a predicate noun)",,,,,,,,,,,,,,,,,,,,
be%2:42:04::,"There was brush , and stands of pine that no grass could grow under , and places so steep that cattle would n't stop to graze .","be%2:42:03:: : have the quality of being; (copula, used with an adjective or a predicate noun)",,,,,,,,,,,,,,,,,,,,
be%2:42:04::,But there was water .,"be%2:42:03:: : have the quality of being; (copula, used with an adjective or a predicate noun)",,,,,,,,,,,,,,,,,,,,
be%2:42:04::,"There was an artificial_lake just out_of_sight in the first stand of trees , fed by a half dozen springs that popped_out of the ground above the hillside orchard .","be%2:42:03:: : have the quality of being; (copula, used with an adjective or a predicate noun)",,,,,,,,,,,,,,,,,,,,
be%2:42:04::,"Yes , there was plenty of water , too_much , and that was probably the trouble .","be%2:42:03:: : have the quality of being; (copula, used with an adjective or a predicate noun)",,,,,,,,,,,,,,,,,,,,
be%2:42:04::,There were tracks of cattle all_over his six hundred and forty acres .,"be%2:42:03:: : have the quality of being; (copula, used with an adjective or a predicate noun)",,,,,,,,,,,,,,,,,,,,
be%2:42:04::,There seemed to be a contemptuous purpose in the way he sat there with his eyes glued to Drexel_Street and his back in_opposition to the church behind him .,"be%2:42:03:: : have the quality of being; (copula, used with an adjective or a predicate noun)",,,,,,,,,,,,,,,,,,,,
be%2:42:04::,"Well , what did that matter when the sun was shining and there were dreams to dream about ?","be%2:42:03:: : have the quality of being; (copula, used with an adjective or a predicate noun)",,,,,,,,,,,,,,,,,,,,
be%2:42:04::,"Then there was the caterer 's ad which read : "" Are you getting_married or having an affair ?","be%2:42:03:: : have the quality of being; (copula, used with an adjective or a predicate noun)",,,,,,,,,,,,,,,,,,,,
be%2:42:04::,"When a witness at court was asked if he had been kicked in the ensuing rumpus , he replied , "" No , it was in the stomach "" .",,,,,,,be%2:42:05:: : occupy a certain position or area; be somewhere,,,,,,,,,,,,,,
be%2:42:04::,""" I may be back "" , he explained , "" and then_again , I may_not "" .","be%2:42:03:: : have the quality of being; (copula, used with an adjective or a predicate noun)",,,,,,,,,,,,,,,,,,,,
be%2:42:04::,There was a short pause for reflection .,"be%2:42:03:: : have the quality of being; (copula, used with an adjective or a predicate noun)",,,,,,,,,,,,,,,,,,,,
be%2:42:04::,""" Oh yes , the other day I reread some of Emerson 's English_Traits , and there was an anecdote about a group of English and Americans visiting Germany , more_than a_hundred years ago .","be%2:42:03:: : have the quality of being; (copula, used with an adjective or a predicate noun)",,,,,,,,,,,,,,,,,,,,
be%2:42:04::,There was a long silence .,"be%2:42:03:: : have the quality of being; (copula, used with an adjective or a predicate noun)",,,,,,,,,,,,,,,,,,,,
be%2:42:04::,"In them , there is usually a group of Anglo-Americans with tragicomic problems , worthy of being explored either in the novel or in the play or in comedy and satire "" .","be%2:42:03:: : have the quality of being; (copula, used with an adjective or a predicate noun)",,,,,,,,,,,,,,,,,,,,
be%2:42:04::,""" There was also Gott_strafe_Angleterre "" , Moreland reminded me , "" and Carthago_delenda_est , or if you will , Deus_strafe_Carthage .","be%2:42:03:: : have the quality of being; (copula, used with an adjective or a predicate noun)",,,,,,,,,,,,,,,,,,,,
be%2:42:04::,"There is a bitter satire for a future writer in that "" .","be%2:42:03:: : have the quality of being; (copula, used with an adjective or a predicate noun)",,,,,,,,,,,,,,,,,,,,
be%2:42:04::,Then there was the General kissing his wife .,"be%2:42:03:: : have the quality of being; (copula, used with an adjective or a predicate noun)",,,,,,,,,,,,,,,,,,,,
be%2:42:04::,It was in_the_air .,,,,,,,be%2:42:05:: : occupy a certain position or area; be somewhere,,,,,,,,,,,,,,
be%2:42:04::,"There had been some coconut in it , for I remember my mother 's taking a quick glance at a stringy bit of this nut on the cheek of one of them and_then putting_down her radish with a shiver .","be%2:42:03:: : have the quality of being; (copula, used with an adjective or a predicate noun)",,,,,,,,,,,,,,,,,,,,
be%2:42:04::,"Although the play does show a certain structural amateurishness ( there are eleven acts varying in length from twenty-five seconds to an hour and a half ) , the statement it makes concerning the ceaseless yearning and searching of youth is profound and worthy of our attention .","be%2:42:03:: : have the quality of being; (copula, used with an adjective or a predicate noun)",,,,,,,,,,,,,,,,,,,,
be%2:42:04::,"Ever since Bambi , and , more recently , Born_Free , there have been a_lot of books about animals , but few compare with Max_Fink 's wry , understated , charming , and immensely readable My_Friend_, the Quizzical_Salamander .","be%2:42:03:: : have the quality of being; (copula, used with an adjective or a predicate noun)",,,,,,,,,,,,,,,,,,,,
be%2:42:04::,"Quasimodo defines his own art as "" the search for what is not there "" .",,,,,,,be%2:42:05:: : occupy a certain position or area; be somewhere,,,,,,,,,,,,,,
be%2:42:04::,"It is , I am reliably given to understand , the technical argot for those who engage in your particular branch of the boost ; i.e. , burglars who rob while the tenants are absent , in contrast to hot slough prowlers , those who work while the occupants are home .","be%2:42:03:: : have the quality of being; (copula, used with an adjective or a predicate noun)",,,,,,,,,,,,,,,,,,,,
be%2:42:04::,"Inscribed around its base is a charm in Balinese , a dialect I take it you do n't comprehend .",,,,,,,be%2:42:05:: : occupy a certain position or area; be somewhere,,,,,,,,,,,,,,
be%2:42:04::,"Still , there it is .",,,,,,,be%2:42:05:: : occupy a certain position or area; be somewhere,,,,,,,,,,,,,,
be%2:42:04::,"In it was a stone Tibetan Buddha I had picked_up in Bombay , and occasionally , to make merit , my wife and I garlanded it with flowers or laid a_few pennies in its lap .",,,,,,,be%2:42:05:: : occupy a certain position or area; be somewhere,,,,,,,,,,,,,,
be%2:42:04::,All musical Paris was there .,,,,,,,be%2:42:05:: : occupy a certain position or area; be somewhere,,,,,,,,,,,,,,
be%2:42:04::,"Han 's student days were at_a time when Europe was in a new intellectual ferment following the revolutions in America and in France , Germany and Italy were rising from divisive nationalisms and a strong wave of intellectual awareness was sweeping the Continent .",,,,,,,be%2:42:05:: : occupy a certain position or area; be somewhere,,,,,,,,,,,,,,
be%2:42:04::,Esmarch was among those who witnessed Oersted 's first demonstration of his discovery .,,,,,,,be%2:42:05:: : occupy a certain position or area; be somewhere,,,,,,,,,,,,,,
be%2:42:04::,And with the shutdown method there will be no argument as to who gets the choice vacation dates .,"be%2:42:03:: : have the quality of being; (copula, used with an adjective or a predicate noun)",,,,,,,,,,,,,,,,,,,,
be%2:42:04::,When was the turning_point ?,"be%2:42:03:: : have the quality of being; (copula, used with an adjective or a predicate noun)",,,,,,,,,,,,,,,,,,,,
be%2:42:04::,There will be losses caused by emergencies that arise while he is away at his off farm job .,"be%2:42:03:: : have the quality of being; (copula, used with an adjective or a predicate noun)",,,,,,,,,,,,,,,,,,,,
be%2:42:04::,Discussed below are some of the main things to look_for when you select a part-time farm .,,,,,,,be%2:42:05:: : occupy a certain position or area; be somewhere,,,,,,,,,,,,,,
be%2:42:04::,"Ahead were perilous , ice filled waters .",,,,,,,be%2:42:05:: : occupy a certain position or area; be somewhere,,,,,,,,,,,,,,
be%2:42:04::,"On previous voyages , it had been in precisely such dangerous situations that he had failed as a leader and captain .","be%2:42:03:: : have the quality of being; (copula, used with an adjective or a predicate noun)",,,,,,,,,,,,,,,,,,,,
be%2:42:04::,"To starboard was a cape a_thousand feet high , patched with ice and snow , populated by thousands of screaming sea_birds .",,,,,,,be%2:42:05:: : occupy a certain position or area; be somewhere,,,,,,,,,,,,,,
be%2:42:04::,To port was a point 200 feet high rising behind to a precipice of 2000 feet .,,,,,,,be%2:42:05:: : occupy a certain position or area; be somewhere,,,,,,,,,,,,,,
be%2:42:04::,"For he seemed to sense at_once that before him was no South_Sea , but the solid bulk of the North_American continent .",,,,,,,be%2:42:05:: : occupy a certain position or area; be somewhere,,,,,,,,,,,,,,
be%2:42:04::,There were other shifts and pay_cuts according to the way individuals had conducted themselves .,"be%2:42:03:: : have the quality of being; (copula, used with an adjective or a predicate noun)",,,,,,,,,,,,,,,,,,,,
be%2:42:04::,"Hughes said that he had understood the party was to be in honour of Jerry_O_'_Connor , the proprieter of a Loop gambling_house .","be%2:42:03:: : have the quality of being; (copula, used with an adjective or a predicate noun)",,,,,,,,,,,,,,,,,,,,
be%2:42:04::,A further example of the incompatible difference in personalities was when two policemen held_up a Torrio beer convoy on a West_Side street and demanded $ 300 to let it through .,"be%2:42:03:: : have the quality of being; (copula, used with an adjective or a predicate noun)",,,,,,,,,,,,,,,,,,,,
be%2:42:04::,Usually it is only_when they approach shallow water on the shore that they build_up to their terrifying heights .,"be%2:42:03:: : have the quality of being; (copula, used with an adjective or a predicate noun)",,,,,,,,,,,,,,,,,,,,
be%2:42:04::,"Since the 1946 disaster there have been 15 tsunami in the Pacific , but only one was of any consequence .","be%2:42:03:: : have the quality of being; (copula, used with an adjective or a predicate noun)",,,,,,,,,,,,,,,,,,,,
be%2:42:04::,"Though there was an occasional good-natured chuckle about Marvin_Goulding , the Jewish officer from Chicago , singing tearfully about the ould sod , no_one really thought it was strange .","be%2:42:03:: : have the quality of being; (copula, used with an adjective or a predicate noun)",,,,,,,,,,,,,,,,,,,,
be%2:42:04::,"Although it was at the Battle_of_The_Little_Horn , about which more words have been written than any other battle in American history , that the 7_th_Cavalry first made its mark in history , the regiment was ten years old by then .","be%2:42:03:: : have the quality of being; (copula, used with an adjective or a predicate noun)",,,,,,,,,,,,,,,,,,,,
be%2:42:04::,"It may be , of_course , that such objectives can be pursued consisently with a policy designed to overthrow Communism ; my point is that where conflicts arise they must always be resolved in_favor_of achieving the indispensable condition for a tolerant world - the absence of Soviet Communist power .","be%2:42:03:: : have the quality of being; (copula, used with an adjective or a predicate noun)",,,,,,,,,,,,,,,,,,,,
be%2:42:04::,"There was the Hungarian Revolution which we praised and mourned , but did nothing about .","be%2:42:03:: : have the quality of being; (copula, used with an adjective or a predicate noun)",,,,,,,,,,,,,,,,,,,,
be%2:42:04::,There was the Polish Revolution which we misunderstood and then helped guide along a course favorable to Soviet interests .,"be%2:42:03:: : have the quality of being; (copula, used with an adjective or a predicate noun)",,,,,,,,,,,,,,,,,,,,
be%2:42:04::,There was the revolution in Tibet which we pretended did not exist .,"be%2:42:03:: : have the quality of being; (copula, used with an adjective or a predicate noun)",,,,,,,,,,,,,,,,,,,,
be%2:42:04::,There had been an eclipse of the moon .,"be%2:42:03:: : have the quality of being; (copula, used with an adjective or a predicate noun)",,,,,,,,,,,,,,,,,,,,
be%2:42:04::,"In those vocational_programs organized with Smith-Hughes money , there may be a close tie between the labor_union and a local employer on_the_one_hand and the vocational teacher on the other .","be%2:42:03:: : have the quality of being; (copula, used with an adjective or a predicate noun)",,,,,,,,,,,,,,,,,,,,
be%2:42:04::,"In my view , there should be a school which offers significant vocational_programs for boys within easy reach of every family in a city .","be%2:42:03:: : have the quality of being; (copula, used with an adjective or a predicate noun)",,,,,,,,,,,,,,,,,,,,
be%2:42:04::,"There is much talk in theological circles about the "" Church as Mission "" and the "" Church 's Mission "" ; theologians have been stressing the fact that the Church does not exist for its own sake but as a testimony in the world for the healing of the world .","be%2:42:03:: : have the quality of being; (copula, used with an adjective or a predicate noun)",,,,,,,,,,,,,,,,,,,,
be%2:42:04::,It is all around us and our only chance now is to let it in .,,,,,,,be%2:42:05:: : occupy a certain position or area; be somewhere,,,,,,,,,,,,,,
be%2:42:04::,It was at my first Communion .,"be%2:42:03:: : have the quality of being; (copula, used with an adjective or a predicate noun)",,,,,,,,,,,,,,,,,,,,
be%2:42:04::,But that was a long_time ago .,occur,,,,,,,,,,,,,,,,,,,,
be%2:42:04::,Why should this be so ?,"be%2:42:03:: : have the quality of being; (copula, used with an adjective or a predicate noun)",,,,,,,,,,,,,,,,,,,,
be%2:42:04::,Then suddenly there was a tremendous revulsion of popular feeling .,"be%2:42:03:: : have the quality of being; (copula, used with an adjective or a predicate noun)",,,,,,,,,,,,,,,,,,,,
be%2:42:04::,"Such characters , with their low existence and often low morality , produce humorous effects in his novels and tales , as they did in the writing of Longstreet and Hooper and Harris , but it need not be added that he gives them far subtler and more intricate functions than they had in the earlier writers ; nor is there need to add that among them are some of the most highly individualized and most successful of his characters .","be%2:42:03:: : have the quality of being; (copula, used with an adjective or a predicate noun)",,,,,,,,,,,,,,,,,,,,
be%2:42:04::,There should be a regular electrical_outlet in the shelter as power may continue in many areas .,"be%2:42:03:: : have the quality of being; (copula, used with an adjective or a predicate noun)",,,,,,,,,,,,,,,,,,,,
be%2:42:04::,"- If there are outside windows in the basement corner where you build a shelter , they should be shielded as shown in the Appendix , page 29 .","be%2:42:03:: : have the quality of being; (copula, used with an adjective or a predicate noun)",,,,,,,,,,,,,,,,,,,,
be%2:42:04::,"On the brief were Solicitor_General_Rankin , Assistant_Attorney_General_Wilkey , Beatrice_Rosenberg and J._F._Bishop .",,,,,,,be%2:42:05:: : occupy a certain position or area; be somewhere,,,,,,,,,,,,,,
be%2:42:04::,"In his answer thereto , he advised the Board that he had made no such statement in 1956 , and asserted that his only claim to "" pioneering "" was in 1952 .",occur,,,,,,,,,,,,,,,,,,,,
be%2:42:04::,There will of_course be times for delay and inaction .,"be%2:42:03:: : have the quality of being; (copula, used with an adjective or a predicate noun)",,,,,,,,,,,,,,,,,,,,
be%2:42:04::,"Since April 15 , 1962 , is on Sunday your return for the calendar_year 1961 will be timely filed if it is filed on or before Monday , April 16 , 1962 .",occur,,,,,,,,,,,,,,,,,,,,
be%2:42:04::,"If you file a Form_1040 , you should indicate in the place provided that there is an overpayment of tax and the amount you want refunded and the amount you want credited against your estimated tax .","be%2:42:03:: : have the quality of being; (copula, used with an adjective or a predicate noun)",,,,,,,,,,,,,,,,,,,,
be%2:42:04::,"Earlier , this woman had been so filled with a chaotic variety of introjects that at_times , when she was in her room alone , it would sound to a passerby as though there were several different persons in the room , as she would vocalize in various kinds of voice .","be%2:42:03:: : have the quality of being; (copula, used with an adjective or a predicate noun)",,,,,,,,,,,,,,,,,,,,
be%2:42:04::,"is Bill 's broken a chair , dominant stress will usually be on the complement a chair .","be%2:42:03:: : have the quality of being; (copula, used with an adjective or a predicate noun)",,,,,,,,,,,,,,,,,,,,
be%2:42:04::,In I know one thing dominant stress will usually be on the complement one thing ; in one thing I know it will usually be on the predicator know .,,,,,,,be%2:42:05:: : occupy a certain position or area; be somewhere,,,,,,,,,,,,,,
be%2:42:04::,In I know one thing dominant stress will usually be on the complement one thing ; in one thing I know it will usually be on the predicator know .,,,,,,,be%2:42:05:: : occupy a certain position or area; be somewhere,,,,,,,,,,,,,,
be%2:42:04::,"In small-town people are very friendly dominant stress will generally be on the complement very friendly ; in the double sentence the smaller the town , the friendlier the people it will generally be on the subjects the town and the people .",,,,,,,be%2:42:05:: : occupy a certain position or area; be somewhere,,,,,,,,,,,,,,
be%2:42:04::,"In small-town people are very friendly dominant stress will generally be on the complement very friendly ; in the double sentence the smaller the town , the friendlier the people it will generally be on the subjects the town and the people .",,,,,,,be%2:42:05:: : occupy a certain position or area; be somewhere,,,,,,,,,,,,,,
be%2:42:04::,dominant stress will generally be on the subject a linguist ; in who 's a linguist ?,,,,,,,be%2:42:05:: : occupy a certain position or area; be somewhere,,,,,,,,,,,,,,
be%2:42:04::,it will generally be on the complement a linguist .,,,,,,,be%2:42:05:: : occupy a certain position or area; be somewhere,,,,,,,,,,,,,,
be%2:42:04::,"Dominant stress is on her luggage both in that 's her luggage , where her luggage is the complement , and in there 's her luggage , where it is the subject .",,,,,,,be%2:42:05:: : occupy a certain position or area; be somewhere,,,,,,,,,,,,,,
be%2:42:04::,"is George put the cat out , dominant stress will ordinarily be on the first complement , the cat , not the second complement out .",,,,,,,be%2:42:05:: : occupy a certain position or area; be somewhere,,,,,,,,,,,,,,
be%2:42:04::,"is George reads the news emotionally , dominant stress may or may not be on the adjunct emotionally .",,,,,,,be%2:42:05:: : occupy a certain position or area; be somewhere,,,,,,,,,,,,,,
be%2:42:04::,"Thus in a context in which there has been discussion of snow but mention of local conditions is new , dominant stress will probably be on here in it rarely snows here , but in a context in which there has been discussion of local weather but no mention of snow , dominant stress will probably be on snows .",,,,,,,be%2:42:05:: : occupy a certain position or area; be somewhere,,,,,,,,,,,,,,
be%2:42:04::,"Thus in a context in which there has been discussion of snow but mention of local conditions is new , dominant stress will probably be on here in it rarely snows here , but in a context in which there has been discussion of local weather but no mention of snow , dominant stress will probably be on snows .","be%2:42:03:: : have the quality of being; (copula, used with an adjective or a predicate noun)",,,,,,,,,,,,,,,,,,,,
be%2:42:04::,"Thus in a context in which there has been discussion of snow but mention of local conditions is new , dominant stress will probably be on here in it rarely snows here , but in a context in which there has been discussion of local weather but no mention of snow , dominant stress will probably be on snows .",,,,,,,be%2:42:05:: : occupy a certain position or area; be somewhere,,,,,,,,,,,,,,
be%2:42:04::,"In I 'll go_with George dominant stress is probably on George ; but if George has just been mentioned prominently ( and the trip to be made has been under discussion ) , what is said is probably I 'll go_with him , and dominant stress is probably on the preposition with .",,,,,,,be%2:42:05:: : occupy a certain position or area; be somewhere,,,,,,,,,,,,,,
