color%1:14:00::,"The volume of ADC cases will decrease , Martin reported , when the community is able to deal effectively with two problems : Relatively limited skills and discrimination in employment because of color .",,,,,,,,,,,,,color%1:07:00:: : a visual attribute of things that results from the light they emit or transmit or reflect,,,,,,,,
color%1:14:00::,"Otherwise , we go_on endlessly trying to draw_the_line , color and other , as to which kind_of man we wish to see dominate .",,,,,,,,,,,,,color%1:07:00:: : a visual attribute of things that results from the light they emit or transmit or reflect,,,,,,,,
comparable_with%5:00:00:comparable:00,"It is true , that nothing has been found comparable_with electricity by communication ; but the phenomena observed had such a degree of analogy to those depending_on electrical distribution that one could not find the slightest difference .",,,,,,,,,,,,,,,,,,,,,
comparable_with%5:00:00:comparable:00,"In any social_system in which communications have an importance comparable_with that of production and other human factors , a point like f in Figure 2 would ( other things being equal ) be the dwelling place for the community leader , while e and h would house the next most important citizens .",,,,,,,,,,,,,,,,,,,,,
conduct%2:41:01::,"But he takes his bearings from the great guidelines of policy , well established precedents , the commitments of the United_States under international charters and treaties , basic statutes , and well understood notions of the American people about how we are to conduct ourselves , in policy literature such_as country papers and National_Security_Council papers accumulated in the Department .",conduct%2:38:01:: : take somebody somewhere,conduct%2:38:00:: : transmit or serve as the medium for transmission,conduct%1:07:00:: : (behavioral attributes) the way a person behaves toward other people,"conduct%2:36:00:: : lead, as in the performance of a composition",conduct%2:29:05:: : behave in a certain manner; show a certain behavior; conduct or comport oneself,conduct%2:36:04:: : lead musicians in the performance of,conduct%2:41:00:: : direct the course of; manage or control,conduct%1:04:00:: : manner of acting or controlling yourself,,,,,,,,,,,,,
conduct%2:41:01::,"The reason for the value of this procedure was simply that the applicants were tested "" at work "" in different situations by the judgment of a number of experts who could see how the salesmen conducted themselves with different , but typical restaurant owners and managers .",conduct%2:38:01:: : take somebody somewhere,conduct%2:38:00:: : transmit or serve as the medium for transmission,conduct%1:07:00:: : (behavioral attributes) the way a person behaves toward other people,"conduct%2:36:00:: : lead, as in the performance of a composition",conduct%2:29:05:: : behave in a certain manner; show a certain behavior; conduct or comport oneself,conduct%2:36:04:: : lead musicians in the performance of,conduct%2:41:00:: : direct the course of; manage or control,conduct%1:04:00:: : manner of acting or controlling yourself,,,,,,,,,,,,,
confine%2:30:01::,"For_the_most_part , this discussion will be confined to results obtained since the introduction of the reference standard .","confine%2:35:01:: : to close within bounds, or otherwise limit or deprive of free movement",confine%2:30:00:: : place limits on (extent or amount or access),confine%2:42:00:: : close in,confine%2:41:00:: : deprive of freedom; take into confinement,confine%2:35:03:: : prevent from leaving or from being removed,,,,,,,,,,,,,,,,
confine%2:30:01::,"But the historian of literature need not confine his attention to biography or to stylistic questions of form , "" texture "" , or technique .","confine%2:35:01:: : to close within bounds, or otherwise limit or deprive of free movement",confine%2:30:00:: : place limits on (extent or amount or access),confine%2:42:00:: : close in,confine%2:41:00:: : deprive of freedom; take into confinement,confine%2:35:03:: : prevent from leaving or from being removed,,,,,,,,,,,,,,,,
confine%2:30:01::,It lost sight of the individual almost entirely and confined itself to rules limiting the exercise of state power for reasons essentially unconnected with justice or morality save as these values might affect international relations .,"confine%2:35:01:: : to close within bounds, or otherwise limit or deprive of free movement",confine%2:30:00:: : place limits on (extent or amount or access),confine%2:42:00:: : close in,confine%2:41:00:: : deprive of freedom; take into confinement,confine%2:35:03:: : prevent from leaving or from being removed,,,,,,,,,,,,,,,,
confine%2:30:01::,The legislature 's role in policy determination in_this area for years has been confined almost solely to the amount of funds appropriated annually for the purchase and operation of vehicles .,"confine%2:35:01:: : to close within bounds, or otherwise limit or deprive of free movement",confine%2:30:00:: : place limits on (extent or amount or access),confine%2:42:00:: : close in,confine%2:41:00:: : deprive of freedom; take into confinement,confine%2:35:03:: : prevent from leaving or from being removed,,,,,,,,,,,,,,,,
conform_to%2:42:01::,"( D ) Since the shape of the drop conforms_to the force field , it does not appreciably affect the distribution of forces in the fluid .",conform_to%2:42:00:: : observe,"conform_to%2:34:00:: : fill, satisfy or meet a want or need or condition or restriction",conform_to%2:30:00:: : behave in accordance or in agreement with,,,,,,,,,,,,,,,,,,
conform_to%2:42:01::,The experimental second_moment **f conforms_to the relation **f in_agreement with theory .,conform_to%2:42:00:: : observe,"conform_to%2:34:00:: : fill, satisfy or meet a want or need or condition or restriction",conform_to%2:30:00:: : behave in accordance or in agreement with,,,,,,,,,,,,,,,,,,
conform_to%2:42:01::,"If the reserve components are to serve effectively in time of war , their basic organization and objectives must conform_to the changing character and missions of the active forces .",conform_to%2:42:00:: : observe,"conform_to%2:34:00:: : fill, satisfy or meet a want or need or condition or restriction",conform_to%2:30:00:: : behave in accordance or in agreement with,,,,,,,,,,,,,,,,,,
conform_to%2:42:01::,"We press him to conform_to our comfortable conceptions and not to bruise our satisfactions with his word , and God 's .",conform_to%2:42:00:: : observe,"conform_to%2:34:00:: : fill, satisfy or meet a want or need or condition or restriction",conform_to%2:30:00:: : behave in accordance or in agreement with,,,,,,,,,,,,,,,,,,
conform_to%2:42:01::,"And even more complex items can be interpreted to conform_to one 's own point_of_view , which is by nature so personal .",conform_to%2:42:00:: : observe,"conform_to%2:34:00:: : fill, satisfy or meet a want or need or condition or restriction",conform_to%2:30:00:: : behave in accordance or in agreement with,,,,,,,,,,,,,,,,,,
conform_to%2:42:01::,"Autosuggestibility , the reaction of the subject in_such_a_way as to conform_to his own expectations of the outcome ( i. e. , that the arm-rise is a reaction to the pressure exerted in the voluntary contraction , because of his knowledge that "" to every reaction there is an equal and opposite reaction "" ) also seems inadequate as an explanation for the following reasons : ( 1 ) the subjects ' apparently genuine experience of surprise when their arms rose , and ( 2 ) manifestations of the phenomenon despite anticipations of something else happening ( e._g. , of becoming dizzy and maybe falling , an expectation spontaneously volunteered by one of the subjects ) .",conform_to%2:42:00:: : observe,"conform_to%2:34:00:: : fill, satisfy or meet a want or need or condition or restriction",conform_to%2:30:00:: : behave in accordance or in agreement with,,,,,,,,,,,,,,,,,,
congressman%1:18:00::,But he added that none of Georgia 's congressmen specifically asked him to offer the resolution .,congressman%1:18:01:: : a male member of the United States House of Representatives,,,,,,,,,,,,,,,,,,,,
congressman%1:18:00::,He 's telling them now to write letters to their Congressmen opposing the disarmament of Germany ' .,congressman%1:18:01:: : a male member of the United States House of Representatives,,,,,,,,,,,,,,,,,,,,
congressman%1:18:00::,"The senior policy officer may be moved to think hard about a problem by any of an infinite variety of stimuli : an idea in his own head , the suggestions of a colleague , a question from the Secretary or the President , a proposal by another department , a communication from a foreign government or an American ambassador abroad , the filing of an item for the agenda of the United_Nations or of any other of dozens of international bodies , a news_item read at the breakfast_table , a question to the President or the Secretary at a news_conference , a speech by a Senator or Congressman , an article in a periodical , a resolution from a national organization , a request for assistance from some private American interests abroad , et_cetera , ad_infinitum .",congressman%1:18:01:: : a male member of the United States House of Representatives,,,,,,,,,,,,,,,,,,,,
cope_with%2:41:00::,We are left helpless to cope_with it because we do not dare speak of it as anything real for fear that to do so would imply a commitment to that which has already been discredited and proved false .,,,,,,,,,,,,,,,,,,,,,
cope_with%2:41:00::,Will advances in human sciences help us build social_structures and governments which will enable us to cope_with people as_effectively_as the primitive combination of protein and nucleic_acid built a structure of molecules which enabled it to adapt to a sea of molecular interaction ?,,,,,,,,,,,,,,,,,,,,,
cope_with%2:41:00::,He has_to cope_with frustration and other emotional_disturbance and anomie .,,,,,,,,,,,,,,,,,,,,,
cope_with%2:41:00::,She found she could cope_with all kinds of problems for which she was once considered too helpless .,,,,,,,,,,,,,,,,,,,,,
cope_with%2:41:00::,"These proposals would go_far toward creating the economic atmosphere favoring growth of the individual , who , in_turn , would help us to cope_with runaway technology .",,,,,,,,,,,,,,,,,,,,,
cope_with%2:41:00::,"Despite the successful rehabilitation of over a half million disabled persons in the first eleven years after 1943 , the existing program was still seen to be inadequate to cope_with the nation 's backlog of an estimated two million disabled .",,,,,,,,,,,,,,,,,,,,,
cope_with%2:41:00::,It is obvious enough that linguists in_general have been less successful in coping_with tone_systems than with consonants or vowels .,,,,,,,,,,,,,,,,,,,,,
cope_with%2:41:00::,SEATO was steamed up and prepared contingency plans for coping_with the military losses in Laos .,,,,,,,,,,,,,,,,,,,,,
cope_with%2:41:00::,"The President has also called_upon the Attorney_General , the Secretary of Health , Education and Welfare , and the Secretary of Labor to coordinate their efforts "" in the development of a program of federal leadership to assist states and local communities in their efforts to cope_with the problem .",,,,,,,,,,,,,,,,,,,,,
cope_with%2:41:00::,"Education must_not be limited to our youth but must be a continuing process through our entire lives , for it is only through knowledge that we , as a nation , can cope_with the dangers that threaten our society .",,,,,,,,,,,,,,,,,,,,,
cope_with%2:41:00::,"In_that decade the partisan zeal to defend Mr._Hoover , and the party 's failure to anticipate or cope_with the depression , caused a great majority of Americans to see the Republican_party as cold and lacking in any sympathy for the problems of human_beings caught_up in the distress and suffering brought_on by the economic crash .",,,,,,,,,,,,,,,,,,,,,
cope_with%2:41:00::,"He seems strong enough inside the party to cope_with any internal opposition ; but if he is up against China 's crusading spirit in world affairs , he is going_to be faced with the_most agonizing choice in his life .",,,,,,,,,,,,,,,,,,,,,
cope_with%2:41:00::,"Coping_with them demands stern discipline - of yourself as_well as of your family , neighbors , friends and anyone you ever talked to on a transoceanic jet .",,,,,,,,,,,,,,,,,,,,,
cope_with%2:41:00::,You should be prepared to cope_with any pitfall such_as plunges into empty pools or shallow ends and all manner of winter as_well as summer lawsuits .,,,,,,,,,,,,,,,,,,,,,
cope_with%2:41:00::,"When no medical problems exist , the newly married_couple generally prefer to cope_with the adjustments of their new relationship by themselves .",,,,,,,,,,,,,,,,,,,,,
cope_with%2:41:00::,"Reduced to its simplest terms , it is an assumption of a collective duty to compensate IN the inability of individuals to cope_with the rigors of the era .",,,,,,,,,,,,,,,,,,,,,
cope_with%2:41:00::,"Inability to care for the other children , difficulty in feeding the babies , who seemed colicky , bone-weary fatigue , repeated crying episodes , and short_tempers reflected the family 's helplessness in coping_with the stressful situation .",,,,,,,,,,,,,,,,,,,,,
cowboy%1:18:00::,"The cowboy films , the cops and robbers films , and the slapstick comedy films culminating in an insane chase are not_only catering to what critics may assume to be a vulgar taste for violence ; these films and these sequences are also seeking_out - instinctively or by_design - the peculiarly cinematic elements of narrative .",,cowboy%1:18:04:: : a male hired hand who tends cattle and performs other duties on horseback,,,,,,,,,,,,,,,,,,,
cowboy%1:18:00::,"They were reluctant to appoint sheriffs to protect the property , thus running_the_risk of creating disturbances such_as that on the Vermejo , and yet the cowboys protested that they got no salary for arresting cattle_thieves and running_the_risk of being shot .",,cowboy%1:18:04:: : a male hired hand who tends cattle and performs other duties on horseback,,,,,,,,,,,,,,,,,,,
cowboy%1:18:00::,This is no_longer a way_of_life for the bearded logger and the wandering cowboy .,,cowboy%1:18:04:: : a male hired hand who tends cattle and performs other duties on horseback,,,,,,,,,,,,,,,,,,,
cowboy%1:18:00::,"Like the cowboy in Stephen_Crane 's "" Blue_Hotel "" , we run around crying , "" Well , I did n't do anything , did I "" ?",,cowboy%1:18:04:: : a male hired hand who tends cattle and performs other duties on horseback,,,,,,,,,,,,,,,,,,,
cowboy%1:18:00::,"For Tom_Horn , it turned_out , had a number of rancher and cowboy witnesses ready and willing to swear with straight_faces that he had been in Bates_Hole the day of the killing .",,cowboy%1:18:04:: : a male hired hand who tends cattle and performs other duties on horseback,,,,,,,,,,,,,,,,,,,
cowboy%1:18:00::,"Even as he became widely known_as a professional killer , nearly every cowboy and rancher in Wyoming seemed proud to call him a friend .",,cowboy%1:18:04:: : a male hired hand who tends cattle and performs other duties on horseback,,,,,,,,,,,,,,,,,,,
cowboy%1:18:00::,"But to the cattlemen who had been facing bankruptcy from rustling losses and to the cowboys who had been faced with lay-offs a_few years earlier , he was becoming a vastly different type of legendary figure .",,cowboy%1:18:04:: : a male hired hand who tends cattle and performs other duties on horseback,,,,,,,,,,,,,,,,,,,
cultivate%2:36:00::,So Prokofieff was able to cultivate his musical talents and harvest a rich reward from them .,,cultivate%2:41:00:: : teach or refine to be discriminative in taste or judgment,,,,,,,,,,,,,,,,,,,
cultivate%2:36:00::,"The psychological strategists in Taiwan stress the great sense of family , cultivated in China over thousands of years .",,cultivate%2:41:00:: : teach or refine to be discriminative in taste or judgment,,,,,,,,,,,,,,,,,,,
cultivate%2:36:00::,Mr._Kennedy did not neglect to cultivate the personal friendship of reporters .,,cultivate%2:41:00:: : teach or refine to be discriminative in taste or judgment,,,,,,,,,,,,,,,,,,,
curb%2:30:01::,""" He 's there "" , he got_out tersely , curbing his rising excitement .",,,,,curb%2:41:00:: : lessen the intensity of; temper; hold in restraint; hold or keep within limits,,,,,,,,,,,,,,,,
curb%2:30:01::,"He will not curb his instinctual desires but release the energy within him that makes him feel truly and fully alive , even if it is only for this brief moment before the apocalypse of annihilation explodes on earth .",,,,,curb%2:41:00:: : lessen the intensity of; temper; hold in restraint; hold or keep within limits,,,,,,,,,,,,,,,,
dainty%5:00:00:refined:01,"He thought how this dainty , fragile older woman threading her way through the streets of Westminster on a day in June , enjoying the flowers in the shops , the greetings from old friends , but never really drawing a deep , passionate breath , was so like himself .",dainty%5:00:00:delicate:00 : delicately beautiful,,,,,,,,,,,,,,,,,,,,
dark-skinned%5:00:00:black:02,"He was tall and dark-skinned , a half-breed , Wilson thought .",dark-skinned%5:00:00:brunet:00 : naturally having skin of a dark color,,,,,,,,,,,,,,,,,,,,
date%1:28:04::,Counsel for du_Pont indicated a preference for the submission of detailed plans by both sides at an early date .,,,,,,,,,,date%1:28:05:: : a particular day specified as the time something happens,,,,,,,,,,,
deploy%2:33:00::,"Notable in this category are the Jupiter and Thor intermediate range ballistic_missiles , which have been successfully developed , produced , and deployed , but the relative importance of which has diminished with the increasing availability of the Atlas intercontinental_ballistic_missile .",deploy%2:35:00:: : to distribute systematically or strategically,,,,,,,,,,,,,,,,,,,,
deploy%2:33:00::,"The second capability is represented by our deployed ground , naval , and air forces in essential forward areas , together with ready reserves capable of effecting early emergency reinforcement .",deploy%2:35:00:: : to distribute systematically or strategically,,,,,,,,,,,,,,,,,,,,
design%2:36:00::,"As you see , the professor has designed a piece of apparatus that forces the bodybuilder to use a wide grip .",design%2:31:00:: : plan something for a specific role or purpose or effect,,,,,,,,,,,,,,,,,,,,
design%2:36:00::,The anode holder shown in figure 2 was designed with two goals in mind .,design%2:31:00:: : plan something for a specific role or purpose or effect,,,,,,,,,,,,,,,,,,,,
design%2:36:00::,"The layout of the sewer_lines was designed by Henry_W._Taylor , who was the engineer for the Manchester_Village disposal_plant .",design%2:31:00:: : plan something for a specific role or purpose or effect,,,,,,,,,,,,,,,,,,,,
design%2:36:00::,The dictionary system is in_no_way dependent upon such summarization or designed around it .,design%2:31:00:: : plan something for a specific role or purpose or effect,,,,,,,,,,,,,,,,,,,,
design%2:36:00::,Most others have been content to give only the most general attention to the broadest and most obvious features of the phonology when designing orthographies .,design%2:31:00:: : plan something for a specific role or purpose or effect,,,,,,,,,,,,,,,,,,,,
design%2:36:00::,Britain began designing the ship in 1956 but got nowhere until the American government decided to end a ban on sharing military secrets with Britain that had been imposed after Fuchs blabbed .,design%2:31:00:: : plan something for a specific role or purpose or effect,,,,,,,,,,,,,,,,,,,,
design%2:36:00::,"Completed and opened for traffic in 1852 , the bridge was designed and built by Lemuel_Chenoweth and his brother , Eli , of Beverly .",design%2:31:00:: : plan something for a specific role or purpose or effect,,,,,,,,,,,,,,,,,,,,
design%2:36:00::,"This includes assistance in - assembling the basic economic , financial , technological , and educational information on_which programing depends ; surveying the needs and requirements over time of broad sectors of the economy , such_as transport , agriculture , communication , industry , and power ; designing the financial mechanisms of the economy in ways that will promote growth without inflation ; and administrative practices which will make possible the more effective review and implementation of programs once established .",design%2:31:00:: : plan something for a specific role or purpose or effect,,,,,,,,,,,,,,,,,,,,
desired%5:00:00:desirable:00,The desired amounts of inactive chlorine and radioactive chlorine were likewise condensed in these cells on the vacuum line following which they were frozen_down and the manifold as_a_whole was sealed_off .,desired%5:00:00:wanted:00 : wanted intensely,,,,,,,,,,,,,,,,,,,,
desired%5:00:00:desirable:00,"Obviously , a satisfactory answer to the third question is imperative , if the argument is to get under_way at_all , for if there is any possibility of doubt whether the patient 's tactual sensitivity had been impaired by the occipital lesion , any findings whatsoever in regard_to the first question become completely ambiguous and fail altogether , of_course , as evidence to establish the desired conclusion .",desired%5:00:00:wanted:00 : wanted intensely,,,,,,,,,,,,,,,,,,,,
desired%5:00:00:desirable:00,"Upon reaching the desired speed , the automatic equipment would cut_off the drive , and the silent but not empty vessel would hurl towards the star which was its journey 's end .",desired%5:00:00:wanted:00 : wanted intensely,,,,,,,,,,,,,,,,,,,,
desired%5:00:00:desirable:00,Sometimes a desired acreage is offered only as part of a larger tract .,desired%5:00:00:wanted:00 : wanted intensely,,,,,,,,,,,,,,,,,,,,
desired%5:00:00:desirable:00,"In all other areas , private initiative of the "" proprietorship "" type should be urged to produce the desired goods and services .",desired%5:00:00:wanted:00 : wanted intensely,,,,,,,,,,,,,,,,,,,,
different%3:00:02::,"This second conclusion , independently arrived at by independent study of material from two pairs of language families as different and remote from one another as these four are , cannot be ignored .",,,different%3:00:00:: : unlike in nature or quality or form or degree,,,,,,,,,,,,,,,,,,
difficulty%1:09:02::,"Despite extensive attempts to obtain highly pure reagents , serious difficulty was experienced in obtaining reproducible rates of reaction .",difficulty%1:04:00:: : an effort that is inconvenient,,,,,,,,,,,,,,,,,,,,
difficulty%1:09:02::,"Following observation of the fact that the reaction rates of supposedly identical reaction mixtures prepared on the same filling manifold and exposed under identical conditions often differed by several hundred per_cent , a systematic series of experiments was undertaken to see whether the difficulty could be ascribed to the method of preparing the chlorine , to the effects of oxygen or moisture or to the effect of surface to volume ratio in the reaction tubes .",,difficulty%1:07:00:: : the quality of being almost beyond one's ability to deal with and requiring a great effort to achieve a positive result,,,,,,,,,,,,,,,,,,,
difficulty%1:09:02::,"We can escape_from such a difficulty by ruling_out the animal as not constituting a trial , but such a solution is not always satisfactory .",difficulty%1:04:00:: : an effort that is inconvenient,,,,,,,,,,,,,,,,,,,,
difficulty%1:09:02::,Most countries in this second category share the difficulty of having many of the structures of a modern political and social_system without the modern standards of performance required to make them effective .,difficulty%1:04:00:: : an effort that is inconvenient,,,,,,,,,,,,,,,,,,,,
difficulty%1:09:02::,"The word "" church "" which turned_up over_and_over_again among Jubal 's words gave him knotty difficulty ; there was no Martian concept to match it - unless one took "" church "" and "" worship "" and "" God "" and "" congregation "" and many other words and equated them to the totality of the only world he had known during growing waiting & & & then forced the concept back into English in_that phrase which had been rejected ( by each differently ) by Jubal , by Mahmoud , by Digby .",difficulty%1:04:00:: : an effort that is inconvenient,,,,,,,,,,,,,,,,,,,,
difficulty%1:09:02::,"I lived in this onward driving contest where each day overcame a new difficulty , gained a new truth , or banished a previous error "" .",difficulty%1:04:00:: : an effort that is inconvenient,,,,,,,,,,,,,,,,,,,,
difficulty%1:09:02::,"But in such an important question , we would be satisfied if the judgment were that the principal objection to the identity of forces which produce electricity and magnetism were only a difficulty , and not a thing which is contrary to_it .",,difficulty%1:07:00:: : the quality of being almost beyond one's ability to deal with and requiring a great effort to achieve a positive result,,,,,,,,,,,,,,,,,,,
difficulty%1:09:02::,"The wrong man in the wrong position , perhaps even in a junior position abroad , can be a source of great harm to our policy ; the attitudes of a U.N. delegate who experiences difficulty in finding adequate housing in New_York_City , or of a foreign diplomat in similar circumstances in our Capital , can be easily be directed against the United_States and all that it stands_for .",difficulty%1:04:00:: : an effort that is inconvenient,,,,,,,,,,,,,,,,,,,,
difficulty%1:09:02::,"Syllables are genuine units , but division of words and sentences into them presents great difficulties .",difficulty%1:04:00:: : an effort that is inconvenient,,,,,,,,,,,,,,,,,,,,
difficulty%1:09:02::,"This explanation of tone difficulties , however , does not apply in all languages .",difficulty%1:04:00:: : an effort that is inconvenient,,,,,,,,,,,,,,,,,,,,
difficulty%1:09:02::,"Again , one major difficulty is the local focus .",difficulty%1:04:00:: : an effort that is inconvenient,,,,,,,,,,,,,,,,,,,,
