1st%5:00:00:ordinal:00,"One of the most damaging tsunami on record followed the famous Lisbon earthquake of November 1 , 1755 ; its waves persisted for a week and were felt as far_away as the English coast .",,,,,,,,,,,,,,,,,,,,,
1st%5:00:00:ordinal:00,"On April 1 , 1953 , after some six months of full-time "" pioneering "" , petitioner discontinued devoting 100 hours a month to preaching , but failed to so notify his local board .",1st%3:00:00:: : preceding all others in time or space or degree,,,,,,,,,,,,,,,,,,,,
abruptly%4:02:00::,"The landscape of Greek history broadens widely , and rather abruptly , in the eighth century B.C. , the age of Homer 's "" rosy fingered Dawn "" .",abruptly%4:02:01:: : quickly and without warning,,,,,,,,,,,,,,,,,,,,
abruptly%4:02:00::,"Left in their previous atom-like smallness , they would have cut_away too abruptly into depth ; and the broad , opaque shapes of pasted paper would have been isolated in such a way as to make them jump_out of plane .",abruptly%4:02:01:: : quickly and without warning,,,,,,,,,,,,,,,,,,,,
abruptly%4:02:00::,"He had not even thought_about her much except once or twice at night in bed when his slowly ranging thoughts would abruptly , almost accidentally , encounter her .",abruptly%4:02:01:: : quickly and without warning,,,,,,,,,,,,,,,,,,,,
abruptly%4:02:00::,"They were climbing the hill in the night when the headlights abruptly probed solid blackness , became two parallel luminous tubes which broadened out into a faint mist of light and ended .",abruptly%4:02:01:: : quickly and without warning,,,,,,,,,,,,,,,,,,,,
abruptly%4:02:00::,The dawn progressed and it seemed that the doctor would never be done_with his ministrations when quite abruptly something broke his revery .,abruptly%4:02:01:: : quickly and without warning,,,,,,,,,,,,,,,,,,,,
abruptly%4:02:00::,"Stevens was grunting over the last empty pocket when Russ abruptly rose and lunged toward Carmer 's hat , which had tumbled half-a-dozen feet away when he first fell .",abruptly%4:02:01:: : quickly and without warning,,,,,,,,,,,,,,,,,,,,
abruptly%4:02:00::,The cloudburst cut_off abruptly .,abruptly%4:02:01:: : quickly and without warning,,,,,,,,,,,,,,,,,,,,
abruptly%4:02:00::,"Eddie stood_up abruptly , then sat_down just as abruptly .",abruptly%4:02:01:: : quickly and without warning,,,,,,,,,,,,,,,,,,,,
abruptly%4:02:00::,"Eddie stood_up abruptly , then sat_down just as abruptly .",abruptly%4:02:01:: : quickly and without warning,,,,,,,,,,,,,,,,,,,,
accustomed%3:00:00::,You should also begin this exercise with a very light barbell until you become accustomed to it balance_wise .,,,,,,,,,,,,,,,,,,,,,
accustomed%3:00:00::,"Those accustomed to broader , more romantic statements of the symphony can be expected to react strongly when they hear this one .",,,,,,,,,,,,,,,,,,,,,
accustomed%3:00:00::,"More often , though , he is so accustomed to submitting to authority on the job without argument that he lives by the same rule at home .",,,,,,,,,,,,,,,,,,,,,
accustomed%3:00:00::,"One is so accustomed to think_of men as the privileged who need but ask and receive , and women as submissive and yielding , that our sympathies are usually enlisted on the side of the man whose love is not returned , and we condemn the woman as a coquette .",,,,,,,,,,,,,,,,,,,,,
accustomed%3:00:00::,She dressed and the accustomed routine restored to her a sense of normal everyday life .,accustomed%5:00:00:usual:00 : commonly used or practiced; usual,,,,,,,,,,,,,,,,,,,,
ache%2:39:01::,"Pensive , introspective , he ached .",,ache%2:29:07:: : be in pain,,,,,,,,,,,,,,,,,,,
ache%2:39:01::,"It entered her body with the ghastly intimacy of an incubus , and its particles , spreading , creeping , crawling , joined themselves into steel_bands that constricted her knees so tightly that they ached ; stifled her lungs so_that her breath came in harsh gasps ; clutched her throat and sucked_up the moisture in her mouth so_that her tongue was dry and hard and stuck_to the roof of her mouth and her teeth were clenched together in the rigid fixture of her jaws .",,,ache%2:39:00:: : be the source of pain,,,,,,,,,,,,,,,,,,
ache%2:39:01::,"Her own body protested , aching painfully where the blood in her veins had congealed , where cold demon wisps still clung and caressed .",,,ache%2:39:00:: : be the source of pain,,,,,,,,,,,,,,,,,,
admirable%5:00:00:estimable:00,"But they deny the values of the city - the crowded , competitive , tolerant city , the "" melting_pot "" which gave_off so many of the most admirable American qualities .",,admirable%5:00:01:reputable:00 : deserving of esteem and respect,,,,,,,,,,,,,,,,,,,
admirable%5:00:00:estimable:00,"This was delivered in a forthright way , without coyness and over pretended interest - an admirable way with children .",,admirable%5:00:01:reputable:00 : deserving of esteem and respect,,,,,,,,,,,,,,,,,,,
admirable%5:00:00:estimable:00,"William_R._Stillwell , an admirable Georgian whose delightful correspondence is preserved in the Georgia_Department_of_Archives_and_History , liked to tease his wife in his letters .",,admirable%5:00:01:reputable:00 : deserving of esteem and respect,,,,,,,,,,,,,,,,,,,
admirable%5:00:00:estimable:00,"An Alabama soldier whose feminine associations were of the more admirable type wrote boastfully of his achievements among the Virginia belles : "" They thout I was a saint .",admirable%5:00:00:pleasing:00 : inspiring admiration or approval,,,,,,,,,,,,,,,,,,,,
and_then%4:02:00::,"The bond issue will go to the state courts for a friendly test_suit to test the validity of the act , and_then the sales will begin and contracts let for repair work on some of Georgia 's most heavily traveled highways .",,,,,,,,,,,,,,,,,,,,,
and_then%4:02:00::,"Saxton has made only one second-half appearance this season and that was in the Washington_State game , for four plays : he returned the kickoff 30 yards , gained five yards through the line and_then uncorked a 56 - yard touchdown run before retiring to the bench .",,,,,,,,,,,,,,,,,,,,,
and_then%4:02:00::,"Skorich , who is 39 years old , played football at Cincinnati_University and_then had a three year professional career as a lineman under Jock_Sutherland with the Pittsburgh_Steelers .",,,,,,,,,,,,,,,,,,,,,
and_then%4:02:00::,He just shot at the board and_then drew circles around the holes to form a bull's-eye .,,,,,,,,,,,,,,,,,,,,,
and_then%4:02:00::,"Such efforts almost always find themselves compelled to ask whether Adam was created capable of growing old and_then older and_then still older , in_short , whether Adam 's life was intended to be part of the process of time .",,,,,,,,,,,,,,,,,,,,,
and_then%4:02:00::,"Such efforts almost always find themselves compelled to ask whether Adam was created capable of growing old and_then older and_then still older , in_short , whether Adam 's life was intended to be part of the process of time .",,,,,,,,,,,,,,,,,,,,,
and_then%4:02:00::,"This and other fears of the solar_system have disappeared gradually , first , with the Ptolemaic_system and its built-in concept of periodicity and_then , more firmly , with the Newtonian innovation of an universal force that could account quantitatively for both terrestrial and celestial motions .",,,,,,,,,,,,,,,,,,,,,
and_then%4:02:00::,"The P.D.I. and later the Popular_Movement protected the Istiqlal 's "" privileged position "" until the fall of Balafrej , and_then the Istiqlal used the same argument , which it had previously ignored , against the pro U.N.F.P. tendencies of the Ibrahim government .",,,,,,,,,,,,,,,,,,,,,
and_then%4:02:00::,"But by the tracing procedure , he could , in a strange obviously kinesthetic manner , find the unseen form ; could piece , as_it_were , the jumbled mass together into an organized whole and_then recognize it as a man or a triangle or whatever it turned_out to be .",,,,,,,,,,,,,,,,,,,,,
and_then%4:02:00::,"Quite naturally , they make the investigation , first , by prohibiting the patient from making any movements at_all and_then , later , by repeating it and allowing the patient to move in any way he wanted to .",,,,,,,,,,,,,,,,,,,,,
and_then%4:02:00::,"In their vases were embodied the basic aesthetic and logical characteristics of Greek civilization , at_first hesitantly in Protogeometric work , and_then more confidently in the initial stages of the Geometric style .",,,,,,,,,,,,,,,,,,,,,
and_then%4:02:00::,"There were three houses in Salyer_'s_Canyon just at the foot of a low bluff , the road winding along the top , entering above , and_then passing down in_front_of the houses , thence to the Vermejo .",,,,,,,,,,,,,,,,,,,,,
and_then%4:02:00::,"And_then : "" There are lots of kids around here "" .",,,,,,,,,,,,,,,,,,,,,
and_then%4:02:00::,"And_then the questions came , eager , interested questions , and many compliments on his having overcome his infirmity .",,,,,,,,,,,,,,,,,,,,,
and_then%4:02:00::,"And_then the Amen_corner took_hold , re-enacting a form of group_participation in worship that stemmed from years before the Greek_chorus , spreading down through the African forest , overseas to the West_Indies , and then here in Alabama .",,,,,,,,,,,,,,,,,,,,,
and_then%4:02:00::,"I would have stood there and died there if left to myself , but Cousin_Simmons grabbed my arm in his viselike grip and fairly plucked me out of there ; and_then I came_to some sanity and plunged away with such extraordinary speed that I outdistanced Cousin_Simmons by_far .",,,,,,,,,,,,,,,,,,,,,
and_then%4:02:00::,She just_about made me carry her upstairs and_then she clung_to me and would n't let me go .,,,,,,,,,,,,,,,,,,,,,
and_then%4:02:00::,The secretary sighed with relief and_then the telephone clicked in Rector 's hand .,,,,,,,,,,,,,,,,,,,,,
and_then%4:02:00::,He told her of the visitors and_then of his plans .,,,,,,,,,,,,,,,,,,,,,
and_then%4:02:00::,"He found Elizabeth in the parlor and asked her to make sure everything was in_order in the residential hall , and_then to take_charge of the office while the party was here .",,,,,,,,,,,,,,,,,,,,,
and_then%4:02:00::,Watson snorted and_then laughed aloud .,,,,,,,,,,,,,,,,,,,,,
and_then%4:02:00::,"She had surprised Hans like she had surprised me when she said she 'd go , and_then she surprised him again when she came_back so quick like she must have , because when I came_in with the snow she was there with a bottle with three white feathers on its label and Hans was holding it angrily by the throat .",,,,,,,,,,,,,,,,,,,,,
and_then%4:02:00::,They waited three minutes and_then crept out on tip-toe ; the halls were empty and they passed down_the_stairs to number nine and listened at the door .,,,,,,,,,,,,,,,,,,,,,
and_then%4:02:00::,"Seems like she 's willing , but the male just flops around all day like the bashful boy who took Jeannie_May behind the barn and_then did n't know what to do , and the people at the zoo have n't got any vulture chicks to show for their trouble .",,,,,,,,,,,,,,,,,,,,,
and_then%4:02:00::,The expedition was under orders to make a swift survey of conditions and_then to return to Earth .,,,,,,,,,,,,,,,,,,,,,
and_then%4:02:00::,""" He works for my father "" , the girl said , and_then seemed to change her mind .",,,,,,,,,,,,,,,,,,,,,
and_then%4:02:00::,""" I have come to talk with you about the future of humor and comedy "" , I told him , at which he started slightly , and_then made us each a stiff drink , with a trembling hand .",,,,,,,,,,,,,,,,,,,,,
and_then%4:02:00::,"And_then Eichmann was quoted as saying , in non English , that Hitler 's plan to exterminate the Jews was nonsense "" .",,,,,,,,,,,,,,,,,,,,,
and_then%4:02:00::,"Moreland went over to stare at his peacocks again , and_then came_back and sat_down , restively .",,,,,,,,,,,,,,,,,,,,,
and_then%4:02:00::,"There had been some coconut in it , for I remember my mother 's taking a quick glance at a stringy bit of this nut on the cheek of one of them and_then putting_down her radish with a shiver .",,,,,,,,,,,,,,,,,,,,,
and_then%4:02:00::,"I asked Quasimodo recently how he accomplished this , and he replied that he had painted his model "" a beautiful shade of red and_then had her breathe on the canvas "" , which was his typical tongue-in-cheek way of chiding me for my lack of sensitivity .",,,,,,,,,,,,,,,,,,,,,
and_then%4:02:00::,"During all this time Roy continued to paint , first only on weekends , and_then , as the family_business permitted , for longer periods .",,,,,,,,,,,,,,,,,,,,,
and_then%4:02:00::,"In the best tradition , he first taught himself to see , then to draw with accuracy and assurance , and_then to paint .",,,,,,,,,,,,,,,,,,,,,
and_then%4:02:00::,"For display , Dr._Baum uses a portion of an * * f , an airborne radar indicator , and_then photographs the screen to obtain a permanent record .",,,,,,,,,,,,,,,,,,,,,
and_then%4:02:00::,"Near the end of his service he wrote that when the war was over he was going to buy two pups , name one of them "" fall-in "" and the other "" close-up "" , and_then shoot them both , "" and that will be the end of ' fall-in ' and ' close-up "" ' .",,,,,,,,,,,,,,,,,,,,,
and_then%4:02:00::,"I would tell them I got a letter from home stating that five of my Negroes had run_away and ten of Pappies But I wold say I recond he did not mind it for he had a plenty more left and_then they would lean to me like a sore_eyd kitten to a basin of milk "" .",,,,,,,,,,,,,,,,,,,,,
and_then%4:02:00::,"He took one step , two , broke_into a trot and_then into a run .",,,,,,,,,,,,,,,,,,,,,
and_then%4:02:00::,"And just as "" Laurie "" Lawrence was first attracted to bright Jo_March , who found him immature by her high standards , and_then had to content himself with her younger sister Amy , so Joe_Jastrow , who had also been writing Henrietta before he came to Johns_Hopkins , had_to content himself with her younger sister , pretty Rachel .",,,,,,,,,,,,,,,,,,,,,
and_then%4:02:00::,"( For each State , make all computations set_forth in items 1 to 8 above , and_then add the results obtained for each State in item 8 . )",,,,,,,,,,,,,,,,,,,,,
and_then%4:02:00::,"And_then , unexpectedly , Stanley made his announcement .",,,,,,,,,,,,,,,,,,,,,
and_then%4:02:00::,Mahzeer would direct the prime_minister 's attention to something out the window and would guide him forward and_then step to one side .,,,,,,,,,,,,,,,,,,,,,
and_then%4:02:00::,He paused on the landing to steady his breathing and_then bent to examine the single door by the light of the weak bulb overhead .,,,,,,,,,,,,,,,,,,,,,
and_then%4:02:00::,"The lieutenant eyed Gun 's reflection in the mirror over the washbowl and_then glanced back at his own face , moving the comb methodically around his head .",,,,,,,,,,,,,,,,,,,,,
and_then%4:02:00::,"He sucked_in his breath and kept quiet while Killpath laid down the sheet again , wound the gold wire stems of his glasses around his ears and_then , eying the report as it lay before him on the desk , intoned , "" Acting_Lieutenant_Gunnar_Matson one failed to see that the station_keeper was properly relieved two absented himself throughout the entire watch without checking on the station 's activities or the whereabouts of his section sergeants three permitted members of the Homicide_Detail of the Inspector's_Bureau to arrogate for their own convenience a patrolman who was thereby prevented from carrying_on his proper assignment four failed to notify the station commander Acting_Captain_O._T._Killpath of a homicide occurring in the district five frequented extralegal establishments known_as after-hours spots for purposes of an unofficial and purportedly social nature and six "" - he leaned_back and peeled_off his glasses "" - failed to co-operate with the Acting_Captain by returning promptly when so ordered .",,,,,,,,,,,,,,,,,,,,,
and_then%4:02:00::,"Casey watched them go , still frowning absently and_then dismissing the matter as he called_for his check .",,,,,,,,,,,,,,,,,,,,,
and_then%4:02:00::,For he remembered too well how he had brought back the loaded drinks to Burton and_then returned to the kitchen to get weaker drinks for himself .,,,,,,,,,,,,,,,,,,,,,
and_then%4:02:00::,"And_then there was a numbing blow to the heart , and another gut flattening blow to the stomach .",,,,,,,,,,,,,,,,,,,,,
and_then%4:02:00::,The herd was watered and_then thrown onto a broad grass flat which was to be the first night 's bedground .,,,,,,,,,,,,,,,,,,,,,
and_then%4:02:00::,"Later , they 'd heard the rumble of thunder and_then , just outside Rockfork , they ran_into rain .",,,,,,,,,,,,,,,,,,,,,
and_then%4:02:00::,"It was not until he moved across the porch that he became aware of them , and_then it was too late .",,,,,,,,,,,,,,,,,,,,,
and_then%4:02:00::,He spread the flight out and led them across a point of land and_then down the coast .,,,,,,,,,,,,,,,,,,,,,
and_then%4:02:00::,And_then he thought Todman might be right .,,,,,,,,,,,,,,,,,,,,,
and_then%4:02:00::,"He took a lead on the enemy , using a distance of five of the radii in his circular sight and_then added another .",,,,,,,,,,,,,,,,,,,,,
and_then%4:02:00::,"Mrs._Roebuck very kindly let me drive through Sante_Fe to a road which would , she said , lead us to Taos and_then Raton and "" eventshahleh "" out of New_Mexico .",,,,,,,,,,,,,,,,,,,,,
and_then%4:02:00::,"And_then came the water - not rain , but solid sheets that sluiced down like water slopping from a bucket .",,,,,,,,,,,,,,,,,,,,,
and_then%4:02:00::,"Then the darkness thinned , and there was light again , and_then bright sunlight .",,,,,,,,,,,,,,,,,,,,,
and_then%4:02:00::,"One_of_these_days , I 'm going to organize a gigantic exhibition that will span everything that 's being painted these days , from extreme abstract_expressionism to extreme photorealism , and_then you 'll be able to see at a glance how much artists have in_common with each other .",,,,,,,,,,,,,,,,,,,,,
and_then%4:02:00::,""" And_then I had another place farther downtown I used as a studio "" .",,,,,,,,,,,,,,,,,,,,,
and_then%4:02:00::,"Agnese , smiling too , said , "" ' Ello "" , and_then more slowly , "" I am happy "" .",,,,,,,,,,,,,,,,,,,,,
and_then%4:02:00::,"Phil turned_away and opened his locker , and_then he heard Mike_Deegan say : "" You 're yellow , Rossoff "" !",,,,,,,,,,,,,,,,,,,,,
as_such%4:02:00::,This does not mean that mythological language as_such can no_longer be used in theology and preaching .,,,,,,,,,,,,,,,,,,,,,
as_such%4:02:00::,The engineering as_such never obtrudes_upon your consciousness .,,,,,,,,,,,,,,,,,,,,,
as_such%4:02:00::,"There is another means which should show the direction and relative value of the stresses in viscoelastic fluids that is not mentioned as_such in the literature , and that is the shape of the suspended drops of low viscosity fluids in shear fields .",,,,,,,,,,,,,,,,,,,,,
as_such%4:02:00::,It does not appear to affect the iodinating mechanism as_such .,,,,,,,,,,,,,,,,,,,,,
as_such%4:02:00::,"The common codes , for religious action as_such and in their ethical aspects for everyday moral behavior , bind the devotees together .",,,,,,,,,,,,,,,,,,,,,
as_such%4:02:00::,As_such it acts_as an anchor for the people .,,,,,,,,,,,,,,,,,,,,,
as_such%4:02:00::,"The necessary inference , as the authors themselves interpret it , would seem to be this : "" ( 1 ) Spatial qualities are not among those grasped by the sense_of_touch , as_such .",,,,,,,,,,,,,,,,,,,,,
as_such%4:02:00::,"It is as_follows : "" The usual sensitivity tests showed that the specific qualities of skin-perceptiveness ( pressure , pain , temperature ) , as_well_as the kinesthetic sensations ( muscular feelings , feelings in the tendons and joints ) , were , as_such , essentially intact , although they seemed , in_comparison_with normal reactions , to be somewhat diminished over the entire body .",,,,,,,,,,,,,,,,,,,,,
as_such%4:02:00::,"But although the idea of communism is very old even in More 's day and did not spring full-clad from his imagination in 1515 , it is not communism as_such that we are concerned with .",,,,,,,,,,,,,,,,,,,,,
as_such%4:02:00::,"In the Analytical phase of their Cubism , Braque and Picasso had not_only had to minimize three-dimensionality simply in_order to preserve it ; they had also had to generalize it - to the point , finally , where the illusion of depth and relief became abstracted from specific three-dimensional entities and was rendered largely as the illusion of depth and relief as_such : as a disembodied attribute and expropriated property detached from everything not itself .",,,,,,,,,,,,,,,,,,,,,
as_such%4:02:00::,"An attempt should be made to see if electricity , in its most latent stage , has any action on the magnet as_such "" .",,,,,,,,,,,,,,,,,,,,,
as_such%4:02:00::,"As_such , it was beyond politics and had no need of justification by a "" message "" .",,,,,,,,,,,,,,,,,,,,,
ask%2:32:00::,"When the crowd was asked whether it wanted to wait one more term to make the race , it voted no - and there were no dissents .",,ask%2:32:04:: : address a question to and expect an answer from,,,,,,,,,,,,,,,,,,,
ask%2:32:00::,"But ask coach Darrell_Royal what position he plays and you 'll get the quick response , "" place_kicker "" .",,ask%2:32:04:: : address a question to and expect an answer from,,,,,,,,,,,,,,,,,,,
ask%2:32:00::,""" How many is that , Jim "" ? asked Willie at one stage of his excavation project .",,ask%2:32:04:: : address a question to and expect an answer from,,,,,,,,,,,,,,,,,,,
ask%2:32:00::,""" I can remove the ball , can't I "" ? asked Palmer of an official .",,ask%2:32:04:: : address a question to and expect an answer from,,,,,,,,,,,,,,,,,,,
ask%2:32:00::,The promoter who wanted to sign him up for the circus asked him how he was able to do it .,,ask%2:32:04:: : address a question to and expect an answer from,,,,,,,,,,,,,,,,,,,
ask%2:32:00::,"If one asks about this play , what it is that comes_upon this community and works within it with such terrible power , there is no better answer to give than "" spirit "" .",,ask%2:32:04:: : address a question to and expect an answer from,,,,,,,,,,,,,,,,,,,
ask%2:32:00::,"Such efforts almost always find themselves compelled to ask whether Adam was created capable of growing old and_then older and_then still older , in_short , whether Adam 's life was intended to be part of the process of time .",,ask%2:32:04:: : address a question to and expect an answer from,,,,,,,,,,,,,,,,,,,
ask%2:32:00::,I sought_out the gardener and asked him what he did to produce such beauties in that weather .,,ask%2:32:04:: : address a question to and expect an answer from,,,,,,,,,,,,,,,,,,,
ask%2:32:00::,I asked him if he took seeds from his own plants .,,ask%2:32:04:: : address a question to and expect an answer from,,,,,,,,,,,,,,,,,,,
ask%2:32:00::,"Did she know , he asked , why the colors of the tubes were important to people 's health ?",,ask%2:32:04:: : address a question to and expect an answer from,,,,,,,,,,,,,,,,,,,
ask%2:32:00::,"And while every writer must be dealt with as a special case , the interested student will want to ask himself a number of questions about each .",,ask%2:32:04:: : address a question to and expect an answer from,,,,,,,,,,,,,,,,,,,
ask%2:32:00::,"If anyone asked us , after we made the remark that the suffering was a bad thing , whether we should think it relevant to what we said to learn that the incident had never occurred and no pain had been suffered at_all , we should say that it made all the difference in_the_world , that what we were asserting to be bad was precisely the suffering we thought had occurred back there , that if this had not occurred , there was nothing left to be bad , and that our assertion was in that case mistaken .",,ask%2:32:04:: : address a question to and expect an answer from,,,,,,,,,,,,,,,,,,,
ask%2:32:00::,"When we repeat the remark that such suffering was a bad thing , the feeling with which we made it last week may be at or near the vanishing_point , but if we were asked whether we meant to say what we did before , we should certainly answer Yes .",,ask%2:32:04:: : address a question to and expect an answer from,,,,,,,,,,,,,,,,,,,
ask%2:32:00::,"If we were asked why we thought so , we should say that these things involve great evil and are wrong , and that to take delight in what is evil or wrong is plainly unfitting .",,ask%2:32:04:: : address a question to and expect an answer from,,,,,,,,,,,,,,,,,,,
ask%2:32:00::,"Concerning the sentence the editor asked , "" What else can Virginia do than to hang the men who have defied her laws , organized treason , and butchered her citizens "" .",,ask%2:32:04:: : address a question to and expect an answer from,,,,,,,,,,,,,,,,,,,
ask%2:32:00::,was a question that had to be asked long before they saw Paree .,,,,,,ask%2:32:02:: : direct or put; seek an answer to,,,,,,,,,,,,,,,
ask%2:32:00::,"When he was asked a question or addressed in such a way that some response was inescapable , he would answer ; if , as often happened , he had to repeat because he had spoken too softly , he would repeat his words in the same way , without emphasis or impatience , only a_little louder .",,,,,,ask%2:32:02:: : direct or put; seek an answer to,,,,,,,,,,,,,,,
ask%2:32:00::,"After a pause , during which he studied Scotty 's face as if Scotty were not there and could not study him too , Mr._McKinley would ask the same questions he had asked downstairs .",,,,,,ask%2:32:02:: : direct or put; seek an answer to,,,,,,,,,,,,,,,
ask%2:32:00::,"After a pause , during which he studied Scotty 's face as if Scotty were not there and could not study him too , Mr._McKinley would ask the same questions he had asked downstairs .",,,,,,ask%2:32:02:: : direct or put; seek an answer to,,,,,,,,,,,,,,,
